{
  "schemaVersion": "1.0.0",
  "oracleVersion": "1.0.0",
  "candidateVersion": "4.0.0-gc.1",
  "cases": [
    {
      "caseId": "CRD-ADV-001",
      "domain": "arc-private-credit",
      "kind": "adversarial",
      "compileDisposition": "compiled",
      "analysisStatus": "incomplete",
      "expectedFindings": [
        {
          "detectorId": "arc-private-credit.public-getter-disclosure",
          "category": "public-getter-disclosure",
          "sourceClass": "collateral",
          "sinkClass": "public-getter",
          "disposition": "detected",
          "minimumSeverity": "informational",
          "minimumConfidence": "low",
          "expectedOccurrenceCount": 1,
          "expectedPrimaryLocation": {
            "sourcePath": "src/Case.sol"
          },
          "requiredEvidenceKinds": [
            "sink-location",
            "source-location"
          ],
          "requiredTraceRoles": [
            "sink",
            "source"
          ],
          "groupingExpectation": "separate-by-detector-and-semantic-sink"
        },
        {
          "detectorId": "arc-private-credit.public-storage-disclosure",
          "category": "public-storage-disclosure",
          "sourceClass": "collateral",
          "sinkClass": "public-storage",
          "disposition": "detected",
          "minimumSeverity": "informational",
          "minimumConfidence": "low",
          "expectedOccurrenceCount": 1,
          "expectedPrimaryLocation": {
            "sourcePath": "src/Case.sol"
          },
          "requiredEvidenceKinds": [
            "sink-location",
            "source-location"
          ],
          "requiredTraceRoles": [
            "sink",
            "source"
          ],
          "groupingExpectation": "separate-by-detector-and-semantic-sink"
        }
      ],
      "expectedIncompleteReasons": [
        "inline-assembly-not-modeled"
      ],
      "allowedAdditionalFindings": [],
      "notes": "Public storage/getter findings remain visible while inline assembly analysis is explicitly incomplete."
    },
    {
      "caseId": "CRD-ADV-002",
      "domain": "arc-private-credit",
      "kind": "adversarial",
      "compileDisposition": "compiled",
      "analysisStatus": "supported",
      "expectedFindings": [
        {
          "detectorId": "arc-private-credit.external-call-disclosure",
          "category": "external-call-disclosure",
          "sourceClass": "loan-terms",
          "sinkClass": "external-call",
          "disposition": "detected",
          "minimumSeverity": "informational",
          "minimumConfidence": "low",
          "expectedOccurrenceCount": 1,
          "expectedPrimaryLocation": {
            "sourcePath": "src/Case.sol"
          },
          "requiredEvidenceKinds": [
            "sink-location",
            "source-location"
          ],
          "requiredTraceRoles": [
            "sink",
            "source"
          ],
          "groupingExpectation": "single-semantic-finding"
        }
      ],
      "expectedIncompleteReasons": [],
      "allowedAdditionalFindings": []
    },
    {
      "caseId": "CRD-ADV-003",
      "domain": "arc-private-credit",
      "kind": "adversarial",
      "compileDisposition": "unsupported-compiler",
      "analysisStatus": "unsupported",
      "expectedFindings": [],
      "expectedIncompleteReasons": [],
      "allowedAdditionalFindings": []
    },
    {
      "caseId": "CRD-ADV-004",
      "domain": "arc-private-credit",
      "kind": "adversarial",
      "compileDisposition": "input-invalid",
      "analysisStatus": "incomplete",
      "expectedFindings": [],
      "expectedIncompleteReasons": [
        "source-input-invalid"
      ],
      "allowedAdditionalFindings": []
    },
    {
      "caseId": "CRD-ADV-005",
      "domain": "arc-private-credit",
      "kind": "adversarial",
      "compileDisposition": "compiled",
      "analysisStatus": "supported",
      "expectedFindings": [
        {
          "detectorId": "arc-private-credit.return-disclosure",
          "category": "return-disclosure",
          "sourceClass": "loan-terms",
          "sinkClass": "return",
          "disposition": "detected",
          "minimumSeverity": "informational",
          "minimumConfidence": "low",
          "expectedOccurrenceCount": 1,
          "expectedPrimaryLocation": {
            "sourcePath": "src/Case.sol"
          },
          "requiredEvidenceKinds": [
            "sink-location",
            "source-location"
          ],
          "requiredTraceRoles": [
            "sink",
            "source"
          ],
          "groupingExpectation": "single-semantic-finding"
        }
      ],
      "expectedIncompleteReasons": [],
      "allowedAdditionalFindings": []
    },
    {
      "caseId": "CRD-ADV-006",
      "domain": "arc-private-credit",
      "kind": "adversarial",
      "compileDisposition": "compiled",
      "analysisStatus": "supported",
      "expectedFindings": [
        {
          "detectorId": "arc-private-credit.event-disclosure",
          "category": "event-disclosure",
          "sourceClass": "loan-terms",
          "sinkClass": "event",
          "disposition": "detected",
          "minimumSeverity": "informational",
          "minimumConfidence": "low",
          "expectedOccurrenceCount": 1,
          "expectedPrimaryLocation": {
            "sourcePath": "src/Case.sol"
          },
          "requiredEvidenceKinds": [
            "sink-location",
            "source-location"
          ],
          "requiredTraceRoles": [
            "sink",
            "source"
          ],
          "groupingExpectation": "single-semantic-finding"
        }
      ],
      "expectedIncompleteReasons": [],
      "allowedAdditionalFindings": []
    },
    {
      "caseId": "CRD-NEG-001",
      "domain": "arc-private-credit",
      "kind": "negative",
      "compileDisposition": "compiled",
      "analysisStatus": "supported",
      "expectedFindings": [],
      "expectedIncompleteReasons": [],
      "allowedAdditionalFindings": []
    },
    {
      "caseId": "CRD-NEG-002",
      "domain": "arc-private-credit",
      "kind": "negative",
      "compileDisposition": "compiled",
      "analysisStatus": "supported",
      "expectedFindings": [],
      "expectedIncompleteReasons": [],
      "allowedAdditionalFindings": []
    },
    {
      "caseId": "CRD-NEG-003",
      "domain": "arc-private-credit",
      "kind": "negative",
      "compileDisposition": "compiled",
      "analysisStatus": "supported",
      "expectedFindings": [],
      "expectedIncompleteReasons": [],
      "allowedAdditionalFindings": []
    },
    {
      "caseId": "CRD-NEG-004",
      "domain": "arc-private-credit",
      "kind": "negative",
      "compileDisposition": "compiled",
      "analysisStatus": "supported",
      "expectedFindings": [
        {
          "detectorId": "arc-private-credit.public-getter-disclosure",
          "category": "public-getter-disclosure",
          "sourceClass": "interest-rate",
          "sinkClass": "public-getter",
          "disposition": "policy-approved",
          "minimumSeverity": "informational",
          "minimumConfidence": "low",
          "expectedOccurrenceCount": 1,
          "expectedPrimaryLocation": {
            "sourcePath": "src/Case.sol"
          },
          "requiredEvidenceKinds": [
            "sink-location",
            "source-location"
          ],
          "requiredTraceRoles": [
            "sink",
            "source"
          ],
          "groupingExpectation": "separate-by-detector-and-semantic-sink"
        },
        {
          "detectorId": "arc-private-credit.public-storage-disclosure",
          "category": "public-storage-disclosure",
          "sourceClass": "interest-rate",
          "sinkClass": "public-storage",
          "disposition": "policy-approved",
          "minimumSeverity": "informational",
          "minimumConfidence": "low",
          "expectedOccurrenceCount": 1,
          "expectedPrimaryLocation": {
            "sourcePath": "src/Case.sol"
          },
          "requiredEvidenceKinds": [
            "sink-location",
            "source-location"
          ],
          "requiredTraceRoles": [
            "sink",
            "source"
          ],
          "groupingExpectation": "separate-by-detector-and-semantic-sink"
        }
      ],
      "expectedIncompleteReasons": [],
      "allowedAdditionalFindings": []
    },
    {
      "caseId": "CRD-NEG-005",
      "domain": "arc-private-credit",
      "kind": "negative",
      "compileDisposition": "compiled",
      "analysisStatus": "supported",
      "expectedFindings": [
        {
          "detectorId": "arc-private-credit.event-disclosure",
          "category": "event-disclosure",
          "sourceClass": "settlement-reference",
          "sinkClass": "event",
          "disposition": "policy-approved",
          "minimumSeverity": "informational",
          "minimumConfidence": "low",
          "expectedOccurrenceCount": 1,
          "expectedPrimaryLocation": {
            "sourcePath": "src/Case.sol"
          },
          "requiredEvidenceKinds": [
            "sink-location",
            "source-location"
          ],
          "requiredTraceRoles": [
            "sink",
            "source"
          ],
          "groupingExpectation": "single-semantic-finding"
        }
      ],
      "expectedIncompleteReasons": [],
      "allowedAdditionalFindings": []
    },
    {
      "caseId": "CRD-NEG-006",
      "domain": "arc-private-credit",
      "kind": "negative",
      "compileDisposition": "compiled",
      "analysisStatus": "supported",
      "expectedFindings": [
        {
          "detectorId": "arc-private-credit.external-call-disclosure",
          "category": "external-call-disclosure",
          "sourceClass": "beneficiary",
          "sinkClass": "external-call",
          "disposition": "accepted-risk",
          "minimumSeverity": "informational",